{
  "schema_version": "2026-07-03",
  "skill_id": "qveris-sector-rotation-map",
  "generated_at": "2026-07-03T09:22:49.078Z",
  "mode": "live",
  "scope": {
    "sector_proxies": [
      "XLK",
      "XLE"
    ],
    "benchmark": "SPY",
    "market": "US",
    "window_days": 30,
    "from": "2026-06-03",
    "to": "2026-07-03"
  },
  "findings": [
    "Rotation proxy set contains 2 sectors or ETFs.",
    "Collected 90 raw records or nested payload rows across selected sector/market sources.",
    "Generated snapshot rotation quadrants for 0 sector proxies.",
    "Initial deterministic signals are relative strength, momentum, volatility, drawdown, liquidity, and catalyst context.",
    "Phase labels should be treated as research labels until verified against benchmark-relative history."
  ],
  "evidence": [
    {
      "role": "sector_performance_snapshot",
      "target": null,
      "tool_id": "financialmodelingprep.stable.sectorperformancesnapshot.retrieve.v1.5ca7b159",
      "ok": true,
      "cost": 24.2,
      "execution_id": "73cc4411-5bd9-44ee-b33e-3c2ca2c5ad5e",
      "record_count": 11,
      "error": null
    },
    {
      "role": "available_sectors",
      "target": null,
      "tool_id": "financialmodelingprep.stable.availablesectors.retrieve.v1.becb02d9",
      "ok": true,
      "cost": 24.2,
      "execution_id": "72896600-8809-40df-926b-6e798f85b840",
      "record_count": 11,
      "error": null
    },
    {
      "role": "proxy_price_history",
      "target": "XLK",
      "tool_id": "financialmodelingprep.stable.historicalpriceeod.full.retrieve.v1.b0c32b22",
      "ok": true,
      "cost": 24.2,
      "execution_id": "36c16653-0521-4997-a4cc-09ed4450e55a",
      "record_count": 21,
      "error": null
    },
    {
      "role": "proxy_price_history",
      "target": "XLE",
      "tool_id": "financialmodelingprep.stable.historicalpriceeod.full.retrieve.v1.b0c32b22",
      "ok": true,
      "cost": 24.2,
      "execution_id": "190c5953-b058-48f8-bb06-89ab1de2e285",
      "record_count": 21,
      "error": null
    },
    {
      "role": "benchmark_price_history",
      "target": "SPY",
      "tool_id": "financialmodelingprep.stable.historicalpriceeod.full.retrieve.v1.b0c32b22",
      "ok": true,
      "cost": 24.2,
      "execution_id": "14d80866-ea03-4572-bbd0-caf26a7152db",
      "record_count": 21,
      "error": null
    },
    {
      "role": "flow_or_revision_confirmation",
      "target": null,
      "tool_id": "alphavantage.news_sentiment.query.v1.467a92c0",
      "ok": true,
      "cost": 2,
      "execution_id": "61c8695b-551f-4a12-8e2c-d9980e1f8423",
      "record_count": 1,
      "error": null
    },
    {
      "role": "etf_symbol_search",
      "target": null,
      "tool_id": "financialmodelingprep.stable.etflist.retrieve.v1.85cd2c31",
      "ok": true,
      "cost": 24.2,
      "execution_id": "433fc475-504c-4583-bb94-a05c75f74cce",
      "record_count": 4,
      "error": null
    }
  ],
  "risks": [
    "Sector ETF proxies may not match local-market sector indices.",
    "Flow, earnings-revision, and valuation coverage can be provider-dependent.",
    "Rotation labels are not trading instructions."
  ],
  "usage": {
    "paid_calls": 7,
    "estimated_credits": 147.2
  },
  "result": {
    "sector_proxies": [
      "XLK",
      "XLE"
    ],
    "benchmark": "SPY",
    "total_records": 90,
    "signal_framework": [
      "relative_strength",
      "momentum",
      "volatility",
      "drawdown",
      "liquidity",
      "catalyst_context"
    ],
    "phase_labels_ready": true,
    "rotation_quadrants": [
      {
        "proxy": "XLK",
        "sector": "Technology",
        "quadrant": "lagging",
        "data_status": "benchmark_relative_scored"
      },
      {
        "proxy": "XLE",
        "sector": "Energy",
        "quadrant": "lagging",
        "data_status": "benchmark_relative_scored"
      }
    ],
    "momentum_scores": [
      {
        "proxy": "XLK",
        "sector": "Technology",
        "score": -7.9702
      },
      {
        "proxy": "XLE",
        "sector": "Energy",
        "score": -9.351
      }
    ],
    "relative_strength_scores": [
      {
        "proxy": "XLK",
        "sector": "Technology",
        "score": -6.716
      },
      {
        "proxy": "XLE",
        "sector": "Energy",
        "score": -8.0968
      }
    ],
    "benchmark_relative_history": [
      {
        "proxy": "XLK",
        "sector": "Technology",
        "proxy_return_pct": -7.9702,
        "benchmark_return_pct": -1.2542,
        "relative_return_pct": -6.716,
        "data_status": "benchmark_relative_scored"
      },
      {
        "proxy": "XLE",
        "sector": "Energy",
        "proxy_return_pct": -9.351,
        "benchmark_return_pct": -1.2542,
        "relative_return_pct": -8.0968,
        "data_status": "benchmark_relative_scored"
      }
    ],
    "evidence_roles": [
      "sector_performance_snapshot",
      "available_sectors",
      "proxy_price_history",
      "proxy_price_history",
      "benchmark_price_history",
      "flow_or_revision_confirmation",
      "etf_symbol_search"
    ],
    "missing_outputs": [],
    "missing_data": []
  }
}